<?xml version="1.0" encoding="UTF-8"?>
<Billing
	xmlns:xsi="http://www.w3.org/2001/XMLSchema-instance"
    xsi:schemaLocation="https://github.com/s1dekick101/cs598-assignment2/blob/main/Part1/cellphone.xsd">
	
	
	<Phonebill>
		<invoiceDate timestamp="07012011"></invoiceDate>
		<invoiceNumber uniqueID="004194129">
			<previousCharges>
				<previousAccountBalance>86.26</previousAccountBalance>
				<paymentsRecieved>0.00</paymentsRecieved>
				<otherChargesandCredits>1.67</otherChargesandCredits>
				<balanceForward>86.26</balanceForward>
			</previousCharges>
			<newCharges>
				<wireless>86.52</wireless>
				<longDistance>20.00</longDistance>
				<Internet>103.00</Internet>
				<currentInstallmentsDue>350.00</currentInstallmentsDue>
				<otherNewAccountCharges>1.67</otherNewAccountCharges>
				<newChargesBalance>561.19</newChargesBalance>
			</newCharges>
			<pastDueAmmount prevAmount="86.26"></pastDueAmmount>
			<totalAmountDue currAmount="561.19"></totalAmountDue>
		</invoiceNumber>
		<customerInformation>
			<firstName>Steve</firstName>
			<lastName>Luke</lastName>
			<street>1245 Main Street</street>
			<city>Duluth</city>
			<state>GA</state>
			<zipCode>30096</zipCode>
			<accountNumber customerID="00001719228"></accountNumber>
		</customerInformation>
		<CompanyContactInformation>
			<companyName>Advantage 360</companyName>
			<street>10681 Foothill Blvd</street>
			<unitNumber>Suite 100</unitNumber>
			<city>Rancho Cucamonga</city>
			<state>CA</state>
			<phone>+1 909 980-1034 </phone>
			<fax>+1 909 944-3995</fax>
			<email>sales@advantage360.com</email>
			<zipCode>91730</zipCode>
		</CompanyContactInformation>
	</Phonebill>
</Billing>